{
  "meta": {
    "schemaVersion": "1.4.0",
    "generatedAt": "2026-03-07T12:00:00Z",
    "blockTitle": "The Drowning Season",
    "blockSubtitle": "Dorchester County Field Survey · OPERATION TIDEGATE · Restricted",
    "worldContract": "The land remembers what was put into it, and the water is returning it now, and no one — not the farmer, not the government men, not the reader — can decide whether that is mercy or punishment.",
    "narrativeVoice": {
      "person": "third",
      "tense": "present",
      "narratorStance": "The narrator inhabits Earl Pratt's perception — his vocabulary, his rhythms, his inability to name what is happening in any language other than soil and season and the behavior of animals.",
      "voiceRationale": "Third person close in present tense creates the paradox the world contract requires: the reader sees through Earl's eyes but cannot intervene, mirroring both Delta Green's observational helplessness and the reader's own position as someone who lifts weight that does not belong to them. The present tense keeps the horror immediate — it is always happening now, the way grief is always happening now."
    },
    "literaryRegister": {
      "name": "Pastoral Waterlog",
      "behaviorDescription": "Prose that earns its nouns. Every object is named precisely — not 'a bird' but 'a green heron standing one-legged in the shallows off the culvert pipe.' Sentences accumulate physical detail the way a field accumulates dew: slowly, until the weight is suddenly visible. The landscape is never backdrop. It thinks. It remembers. Dialogue is sparse, dialect-honest without condescension, and always reveals more about what is not being said.",
      "forbiddenMoves": [
        "Adjectives that editorialize — 'eerie,' 'ominous,' 'sinister,' 'eldritch.' The prose describes; the reader supplies the dread.",
        "Metaphors that reference anything outside the Eastern Shore — no literary allusions, no urban comparisons, no academic vocabulary. Earl's frame of reference is tobacco, tide, and thirty years of marriage.",
        "Interior monologue that explains what Earl is feeling. His feelings are visible only through what he does with his hands and where he chooses to look.",
        "Any sentence that could appear in a Lovecraft story. The register is Steinbeck country, not Providence.",
        "Rushed pacing — every sentence must feel like it has time to breathe, even when describing something terrible."
      ],
      "typographicBehavior": "Week 1: clean, steady, warm — the typefaces are confident and the page feels like a well-kept field journal. By Week 3, marginal annotations begin to appear on fragments as if someone (Earl? the agents? the reader?) is adding notes after the fact. By Week 5, the spacing between document elements may tighten slightly, as if the pages are being compressed by water pressure. Week 6 returns to the clean warmth of Week 1 — either because order has been restored or because the land has finished what it was doing and is calm again."
    },
    "weeklyComponentType": "gauge-reading",
    "structuralShape": {
      "resolution": "partial",
      "temporalOrder": "fragmented",
      "narratorReliability": "multiple",
      "promptFragmentRelationship": "fragments-deepen",
      "shapeRationale": "The world contract asks whether return is mercy or punishment — partial resolution serves this because the reader cannot be given a clean answer. Fragmented temporal order mirrors both the tidal cycle (events recur, not progress) and Earl's grief (memory does not move forward). Multiple reliability reflects the gap between Earl's ground-level perception, Delta Green's institutional framing, and the county records that predate both. Session prompts show Earl's present experience; fragments deepen by revealing the machinery beneath it — the prior operations, the older losses, the pattern the water has been repeating."
    },
    "demoPassword": "HERON",
    "passwordLength": 5,
    "passwordEncryptedEnding": "vvXp2WzyMcKMYgfUhlXEwSiJxi0Le1UGPzD5YwbkekeVeta2rOpupizOdiVpAD5BQo9Qe_pXhqsn3NPJVlYIfvE0IurF-kdydG3laPUX-PCXWc8IezfbJSgaXx3NG1SLrWM8yR_Sf95hg-hVRr5lXwvBJcB3Sa6wCVsMmpNJpy-uKRYjM8Y7JtGCnE9hVg5jE8zNvJ3Vr5-qf_fAw6r91Pzju6z5JHYdbQxZVlWGdTOBRKq9jkqXwDKDib0LRZGTxU-R2xt5AYSakiyriMmmkO-8Av4hP67vTtN_3qzmFKJP8-3jtbry1hemRhW74FiwaeRyae5VFGKEiNsOJezzj2ftOzLlAVok_jtIpG9SsojqIkgLoOsGDUL0yslmD8BBnkQbaDhwufmIiyXT8k4cuzkiawcQzuK1lQXorxA1M4FILRS5b94wz3HDhj9IVJHvZbzgSspGAtfrLjKX3fUZq3i5DDE-IfkDLGs4DnMVnJoot-1NmrD6ncdcPWWu-VS-DMi-f92RLvpMnCb4yGDc50CWzNbxSFJd1tnlbqWjfRHf4U7HpU6uQLNbRDANop4lCytA1njUP6dxWZX_Ogeb4NSMzqG2eN0niEDqkqSK3VqLRs3Ghv2Zr97RuTSI3dwV_5ymcjLaMqHpB3on11Fz-tA0e2M6MNG8zzYB28jQLqLQ1tl7087K2EiNScwODvZA1vh9ffyRKJp8VD0l8e25Sgj3GHWljKr3zzuQxI3nfSuiPlMBWGybm20E4lAxIyiZlwmCpGh0UOrYWHInY_HRSxCSHgKGmWDb5Y6JTeT1gBJ2u-kGPZgf0B0ugSGme5KJJ4pZB3DoGkFwrzK8dffBXwsQbqCaituELblwJ1vAgAw8-NBCToHyMQKd7530EqdNP3bp_8G6KBmnF_jRd8yN4BA6kIYEMXTWsbLLiDR-KGfv5YJM_u2qa4sWTqJb0vt9PwgVnMOzOwshcBdQQxhLmdCTxVaauxfOlGbLjUvDfCH645GQO3GIn2lBg5zZMfdgoe3YL4XwNmGFWfp3iRGsO_j-xdBBrWYazIUg3yt1Z1YH-ovorJeJacAzv-dcSa8nBoooPd_Q66Az6-OK_VVLs7-xcJaV3X1D45z0u58hMQOi36yONvnJ_Cp4JzeaZHx_U-utkYHH5bJ_e_NZ0Mt1fty-qScR_kpCCQxXyC4Dvz2UjfpRXg74Dr5nn-mopZGflqjwCv6mlCatkbGIJsYOFf_AZGnDsQPx-62LjPBvtOp6y2ZmxwAKEPbfrqQZ-g1WGfJjYG57VbP3MkUG8VUeglaHapHyLZpNokWXx1RQhrdicUR10qyFBVDhavVbIilM6rDl0xaFWvcsXt8siq7ZRlItLfuBco_qzaLvQSwWQtIHXmT3BfNvFzs2EMmziWw8JSXjm3HLmQHRlmU27uWDmNY1-RON4C-kQAcsyUDkpL8zKONQ_qBgOd7DLt2wuzy_XiSSgX8x8-b1CNyVPaajpC8u-N0BMh9UF366WKCApNafmBn2hbJlcX3-J-tVEKECa7CUbTvlV5sEl3tWf_4zyqb7pYHhtDyeMso6XWkf6u-KSvTZQeyyqZQ4e7SIsBwrV8aRBAqnGd-Zi7c4Sjs_xREfyHgbs9jWEVkvbJGGbWavXZr6tk5y-QON0MTRlnjPRv7CpZ0YIT9unMwSSP-5MY3SLtIHMfLfMRu58zxlKnf6fXHhlBWRTKMz6-P_ElR_6_dkGB4dT2qShq8wRDG_6FXCIkKZ6iHKiuj7E1pKD7Q4kRmjOZ6ACT71HnT59oCQA8KUxf7m5JJzGUanVNDOBYYs1LPa2412WB93Dd5cmA219szRjaxbxG2N5CwnFA_M9kcIOKOXVOHsaLu48RBnEjp5z4z-u6cAEvzAklvTFJ_-ep1apoKuxIETh0i72HnXs-ZA34MFOwIfTxctMOMZ8T_CObMPUqT4aJEq-j0XwLywZUPlMudMziItcSne2pKMYzM3O4I_sdkt2XDv4r1hj7tdJji_l94r6F72v9934C3EgbGhgpMcS-1UZiODgGe2x8N_7CHLvLPL4KFZDymo6RHRSjY2Ie0-Von_hIuiRYYbaGVuS39Ijf_hIv7R5opIAShgXg9w7XRVBX2fa-OgWWswtlVXrhY26J4Aca5Mrc5wL2nY0ueUTQcmr76abh3yrttSNJpHdVOytadby08It68aNJUMaTMf0m_-aL7Ji4pxXk2-NFowEb7XuOeEYEX2wdY2BXICRpdNEY3NBkI4ZvqWPvfNByEsZwVmHcDe0c1pfRzgiU_GDCdxARcGhgeqLKhk4w2YwvH5fjCcxV046_UzGzAu3sEP2piD9xnUpUQCqhzJf5yn-ZwGK7mPcVh-_HZRXD6szhtdLkyqE7xBxjsa6ZN8wACqT_ZI1_Ybz7Vwsq_vOxNgAQSP5i-UozSUHIv8MzKAGx1_cu65yJORjDJ2mSRtyZdXWRpHG0flQRy2NiJHwymRqjXU-ANSm1guEYxtzJeOUpIo0FP6QKRZHO8-uupEVvhWrU3p0CAD4fGJDt0qM_qBPIAZgjSbp-IZfwLrCOOWeMNHKkByl-ZlE2b9IaWx9WS3uUjOJ4XptwsgrjSL3zBngQgjEmWLR29sx4-yzXjf3-qTQewXNjCw_YWTd2jMESQjRVrDP1ii2o9LF1wh1obyFuWGeeyqWyTpsSTb55TWhaTrfFxf9DB50lH2gII2V9bid5h0buDeVNyZu-Yk-kcOyXPTGghQzAxhWD1qJHmxlQiyjmMe1ZvhhQEhGLE_4_3YgyRGWiSpGt7AhnV58RgA87fEssZI_FhKVvsq4XpIX4PMxtXVkV9riS26aEMWXzm9yGUZMtwLpmDLTK3GGIzcgI5aFCdQQlx3bAh1-HnLxDc9UEzpjJ1nQZ-CMUe7NThEnIu4ubbLYyctyy_dcCR2Cxs63T2a-TIZ5JUIqm1JOtwW_jED6P5EYTnCa6nE2oQaU0oG0wSYQ3fZB5F4D9QzlNuFKJxnvY71fK4nlwBks77nOAn18ke_tMUrk1sxY_OScar1c47iXcKKnwn9PN6FHNtq8UKTw1CGC81V3FfKGPcI87HgsZfMZ8JARkW_OiOFOl-THrymbDFXTbGQvVDoAbDjcq5BC2zODKhxXH7wk-q8Zk_6f15uxJls8AtlbEZkOkecC-oV4Fo04xylDp4MFN19ZQqfHidHMfT-Ym_mq81KhtIS42E_n01JRpOxUWzyy-ZjiqX_MUP-thC30pkiyAC6sv2ZRqbcVjNBiEVZb1WcGnpXPs2LZqQ4klXRjjnaPmLeePmlDcqTpEAXcTLYeJhCc6oMzcwKwsjDlxtinDJ4F1-iO71RKJFTT6-HfiffvB7RAB2UghjFJFJO6xA1dAfqmcxZRvAjCN1EQwRy4oHeWNWYKZ1qHto4YFP4jgsghr6bYn1Rwwm0pEyf5yhrai8P9YgRvV_BT05waZfFpw_mUYqMJJbF8mR85BbsRisjVzYHnxJKH8rLrSmqbaWcAnFNV6ivAC1YnlevxlVCQo4wy-kAggxgtVay7WU1OvGQOYlPnMJbN84UZSsJd7pLCuTOg7yfLMvQHJF3Nqr10V87NSylAyNcdn_89z2Ap4m3pqACVNDopOJvdzYUsAudhDdm9hC5ZArQGk9Bx7tIrFqNBUVCYO7dkzyhh8zhyxCkoMCOmO7TBYJYW-KXz3YozcnjdUnScbIsPBVJbTbNKiePpeqcdtCrTtWAmTjZckNgUKCyWq-aeyAN613jJX0VhVX3t28iqvNjHqHipvgwEUYidbMlbcgD1gzC8e-Ttaseh6YR8D3vidUq8GLwoOfNdgFxJku0ACB4wcbIgG3tpxaKLJHIkOXAuEawMgHVHR47JIst5RQmcglsbPDn_JSadZXCD4s7rzdoK2yZLifuisbaQl_rDWgg7VUN5VTQcDtOvEmmbrvjLxlBe438G9_3btoYCg-UKNcOYMEQAmysIVdAKB70l8-12S6jhK3F2Gh_aooGDkuAJVT96M5UQSy2i6woYe1tlDit2HWvLn-negdaU0CYcbaNKlRN3tM_nbcdOR_nJ9zu6caCkT28D4hzaVWBmY7k7cd1bRkN4Y7PGF_iFiaeY8p7oaYlu5qJjC9O0hEvE024NjCOQzXTlHZd8hxTuVeX6iAycHwHcnWLuuKZfBUX1uqoklmegSBdVEUnzPzez78-DwP3df8tDQ_kczapB7hXK90--o2bvPxNn-LUdIR29V1DslSUQA--5SXuNolrk2LfsSyzLj4dI8h6MT4cHd78JWfDNYyhRMa8SmNBbSb_b5O0ScR-3cTJgozTDAW27a7EVdUhXG2a7qA2HmowErbyPVRzNvycAp4ErD2HcRt72BqMIKzT7BkmWXXZlN0TswGJ8t7kpHDejGr9R4UGhdsdtkPphykN5W1eJQRx3qB4lCEg-8WlrKOZhFq3bW121dns7mVAbKiiL9_-GWA2mp-uX8DvvC_aiRCVin9tn5uHrVr7Ap6L_puzPWjPRWkXVVL2zJdK9WDj9_h27dtxNJz1Q83bseHQS9dJs9Ghl9_s3UEB-688OexKaxR0b-J7iaGKK3Cl6IwtAif1vjxZGuud79yyF2oiYWkCuH9mm0uYPAZLAsAtn4LtuepR7W1YeMztP1JvYE4Ya5aTK2KjBgZpxSOBMjjxfxi8nT1KaGCBxjW_sz3hrSqxYmz-4SjyuCAQ6EesPkf6Lkkjj1OS6s2CQhHoV5wI89StYvMU_Yo513M6PEhpEzQnansLH-NjxEn3YyOJTboKwJa7LxQyiASwwvQaUPcA8dwR9-9yJYAQdEORmuXOrFAAOxsSgaUuAaXoYlbfUiKy1JILh7IdVqPhQYIeYJooWO-CQm34TDl8PTEx2CLstdZ-FwyFcCnVR8uwRSQwWVvFwVvW_ZXfXwtjo5o0nFZtJlsCVM7mSUbqi4j9Avt6zVaTZkVIAhtk41Eh6EvkHtyOw1wLQtFqUH2IpwuMInWdIybeBBY6wFiI2uHQWv-eV5M8cTyf_M8xfTF1DQ",
    "liftoScript": "# Generic Strength Block (fixture placeholder — personal program scrubbed, see DECISIONS D17)\nDay A: Squat 3x5 / Bench Press 3x5 / Pull-Up 3xAMRAP\nDay B: Deadlift 3x5 / Overhead Press 3x5 / Row 3x8\nConditioning: intervals 8x30s\nProgression: add small increments every block at RPE 7-8.",
    "weekCount": 6,
    "totalSessions": 30
  },
  "theme": {
    "visualArchetype": "pastoral",
    "palette": {
      "ink": "#273126",
      "paper": "#f4efdf",
      "accent": "#6d7f4d",
      "muted": "#7d735d",
      "rule": "#c6b89e",
      "fog": "#dbe4d3"
    }
  },
  "weeks": [
    {
      "weekNumber": 1,
      "title": "The Property Line",
      "epigraph": {
        "text": "Water table at 14 inches. Nominal for March. Station BW-14 offline since November.",
        "attribution": "Dorchester County Water Authority, monthly reading, March 1962"
      },
      "isBossWeek": false,
      "overflow": true,